INFO: pocketsphinx.c(152): Parsed model-specific feature parameters from ../../model/en-us/en-us/feat.params
Current configuration:
[NAME]			[DEFLT]		[VALUE]
-agc			none		none
-agcthresh		2.0		2.000000e+00
-allphone				
-allphone_ci		no		no
-alpha			0.97		9.700000e-01
-ascale			20.0		2.000000e+01
-aw			1		1
-backtrace		no		no
-beam			1e-48		1.000000e-48
-bestpath		yes		no
-bestpathlw		9.5		9.500000e+00
-ceplen			13		13
-cmn			live		batch
-cmninit		40,3,-1		41.00,-5.29,-0.12,5.09,2.48,-4.07,-1.37,-1.78,-5.08,-2.05,-6.45,-1.42,1.17
-compallsen		no		no
-debug					0
-dict					../../model/en-us/cmudict-en-us.dict
-dictcase		no		no
-dither			no		no
-doublebw		no		no
-ds			1		1
-fdict					
-feat			1s_c_d_dd	1s_c_d_dd
-featparams				
-fillprob		1e-8		1.000000e-08
-frate			100		100
-fsg					
-fsgusealtpron		yes		yes
-fsgusefiller		yes		yes
-fwdflat		yes		no
-fwdflatbeam		1e-64		1.000000e-64
-fwdflatefwid		4		4
-fwdflatlw		8.5		8.500000e+00
-fwdflatsfwin		25		25
-fwdflatwbeam		7e-29		7.000000e-29
-fwdtree		yes		yes
-hmm					../../model/en-us/en-us
-input_endian		little		little
-jsgf					
-keyphrase				
-kws					
-kws_delay		10		10
-kws_plp		1e-1		1.000000e-01
-kws_threshold		1		1.000000e+00
-latsize		5000		5000
-lda					
-ldadim			0		0
-lifter			0		22
-lm					../../model/en-us/en-us.lm.bin
-lmctl					
-lmname					
-logbase		1.0001		1.000100e+00
-logfn					
-logspec		no		no
-lowerf			133.33334	1.300000e+02
-lpbeam			1e-40		1.000000e-40
-lponlybeam		7e-29		7.000000e-29
-lw			6.5		6.500000e+00
-maxhmmpf		30000		30000
-maxwpf			-1		-1
-mdef					
-mean					
-mfclogdir				
-min_endfr		0		0
-mixw					
-mixwfloor		0.0000001	1.000000e-07
-mllr					
-mmap			yes		yes
-ncep			13		13
-nfft			512		512
-nfilt			40		25
-nwpen			1.0		1.000000e+00
-pbeam			1e-48		1.000000e-48
-pip			1.0		1.000000e+00
-pl_beam		1e-10		1.000000e-10
-pl_pbeam		1e-10		1.000000e-10
-pl_pip			1.0		1.000000e+00
-pl_weight		3.0		3.000000e+00
-pl_window		5		5
-rawlogdir				
-remove_dc		no		no
-remove_noise		yes		yes
-remove_silence		yes		yes
-round_filters		yes		yes
-samprate		16000		1.600000e+04
-seed			-1		-1
-sendump				
-senlogdir				
-senmgau				
-silprob		0.005		5.000000e-03
-smoothspec		no		no
-svspec					0-12/13-25/26-38
-tmat					
-tmatfloor		0.0001		1.000000e-04
-topn			4		4
-topn_beam		0		0
-toprule				
-transform		legacy		dct
-unit_area		yes		yes
-upperf			6855.4976	6.800000e+03
-uw			1.0		1.000000e+00
-vad_postspeech		50		50
-vad_prespeech		20		20
-vad_startspeech	10		10
-vad_threshold		2.0		2.000000e+00
-var					
-varfloor		0.0001		1.000000e-04
-varnorm		no		no
-verbose		no		no
-warp_params				
-warp_type		inverse_linear	inverse_linear
-wbeam			7e-29		7.000000e-29
-wip			0.65		6.500000e-01
-wlen			0.025625	2.562500e-02

INFO: feat.c(715): Initializing feature stream to type: '1s_c_d_dd', ceplen=13, CMN='batch', VARNORM='no', AGC='none'
INFO: acmod.c(162): Using subvector specification 0-12/13-25/26-38
INFO: mdef.c(518): Reading model definition: ../../model/en-us/en-us/mdef
INFO: mdef.c(531): Found byte-order mark BMDF, assuming this is a binary mdef file
INFO: bin_mdef.c(336): Reading binary model definition: ../../model/en-us/en-us/mdef
INFO: bin_mdef.c(516): 42 CI-phone, 137053 CD-phone, 3 emitstate/phone, 126 CI-sen, 5126 Sen, 29324 Sen-Seq
INFO: tmat.c(149): Reading HMM transition probability matrices: ../../model/en-us/en-us/transition_matrices
INFO: acmod.c(113): Attempting to use PTM computation module
INFO: ms_gauden.c(127): Reading mixture gaussian parameter: ../../model/en-us/en-us/means
INFO: ms_gauden.c(242): 42 codebook, 3 feature, size: 
INFO: ms_gauden.c(244):  128x13
INFO: ms_gauden.c(244):  128x13
INFO: ms_gauden.c(244):  128x13
INFO: ms_gauden.c(127): Reading mixture gaussian parameter: ../../model/en-us/en-us/variances
INFO: ms_gauden.c(242): 42 codebook, 3 feature, size: 
INFO: ms_gauden.c(244):  128x13
INFO: ms_gauden.c(244):  128x13
INFO: ms_gauden.c(244):  128x13
INFO: ms_gauden.c(304): 222 variance values floored
INFO: ptm_mgau.c(476): Loading senones from dump file ../../model/en-us/en-us/sendump
INFO: ptm_mgau.c(500): BEGIN FILE FORMAT DESCRIPTION
INFO: ptm_mgau.c(563): Rows: 128, Columns: 5126
INFO: ptm_mgau.c(595): Using memory-mapped I/O for senones
INFO: ptm_mgau.c(838): Maximum top-N: 4
INFO: phone_loop_search.c(114): State beam -225 Phone exit beam -225 Insertion penalty 0
INFO: dict.c(320): Allocating 138824 * 32 bytes (4338 KiB) for word entries
INFO: dict.c(333): Reading main dictionary: ../../model/en-us/cmudict-en-us.dict
INFO: dict.c(213): Dictionary size 134723, allocated 1016 KiB for strings, 1679 KiB for phones
INFO: dict.c(336): 134723 words read
INFO: dict.c(358): Reading filler dictionary: ../../model/en-us/en-us/noisedict
INFO: dict.c(213): Dictionary size 134728, allocated 0 KiB for strings, 0 KiB for phones
INFO: dict.c(361): 5 words read
INFO: dict2pid.c(396): Building PID tables for dictionary
INFO: dict2pid.c(406): Allocating 42^3 * 2 bytes (144 KiB) for word-initial triphones
INFO: dict2pid.c(132): Allocated 42672 bytes (41 KiB) for word-final triphones
INFO: dict2pid.c(196): Allocated 42672 bytes (41 KiB) for single-phone word triphones
INFO: ngram_model_trie.c(354): Trying to read LM in trie binary format
INFO: ngram_search_fwdtree.c(74): Initializing search tree
INFO: ngram_search_fwdtree.c(101): 791 unique initial diphones
INFO: ngram_search_fwdtree.c(186): Creating search channels
INFO: ngram_search_fwdtree.c(323): Max nonroot chan increased to 152609
INFO: ngram_search_fwdtree.c(333): Created 723 root, 152481 non-root channels, 53 single-phone words
INFO: cmn.c(133): CMN: 41.00 -5.29 -0.12  5.09  2.48 -4.07 -1.37 -1.78 -5.08 -2.05 -6.45 -1.42  1.17 
INFO: ngram_search_fwdtree.c(1550):     2528 words recognized (10/fr)
INFO: ngram_search_fwdtree.c(1552):   663904 senones evaluated (2505/fr)
INFO: ngram_search_fwdtree.c(1556):  1516507 channels searched (5722/fr), 149505 1st, 96342 last
INFO: ngram_search_fwdtree.c(1559):     5650 words for which last channels evaluated (21/fr)
INFO: ngram_search_fwdtree.c(1561):    55736 candidate words for entering last phone (210/fr)
INFO: ngram_search_fwdtree.c(1564): fwdtree 0.85 CPU 0.322 xRT
INFO: ngram_search_fwdtree.c(1567): fwdtree 0.87 wall 0.327 xRT
INFO: ngram_search.c(1250): lattice start node <s>.0 end node </s>.212
INFO: ngram_search.c(1276): Eliminated 2 nodes before end node
INFO: ngram_search.c(1381): Lattice has 575 nodes, 1392 links
INFO: ps_lattice.c(1380): Bestpath score: -7317
INFO: ps_lattice.c(1384): Normalizer P(O) = alpha(</s>:212:263) = -672378
INFO: ps_lattice.c(1441): Joint P(O,S) = -687596 P(S|O) = -15218
FWDFLAT: go forward ten meters (-7728)
P(S|O) = -15218
[SPEECH] [SPEECH] 209 -> (211,211) 0.041132
[NOISE] [NOISE] 209 -> (211,211) 0.020500
<sil> <sil> 209 -> (211,211) 0.101290
<sil> <sil> 206 -> (208,208) 0.004488
<sil> <sil> 203 -> (205,205) 0.000536
so so 195 -> (205,216) 0.000391
leaders leaders 155 -> (194,213) 0.016074
majors majors 153 -> (194,213) 0.012557
readers readers 155 -> (192,213) 0.014153
meters meters 153 -> (173,221) 0.793480
<sil> <sil> 152 -> (154,154) 0.000392
<sil> <sil> 150 -> (152,152) 0.110620
<sil> <sil> 147 -> (149,149) 0.018053
<sil> <sil> 144 -> (146,146) 0.000988
and and 136 -> (146,161) 0.004677
can't can't 121 -> (145,148) 0.000112
end end 131 -> (145,160) 0.000366
tend tend 117 -> (144,162) 0.000241
and and(2) 131 -> (144,162) 0.040036
an an(2) 136 -> (142,160) 0.000130
in in 135 -> (140,156) 0.000532
an an 131 -> (138,162) 0.014366
can can 121 -> (137,164) 0.015389
ten ten 117 -> (136,164) 0.831003
[SPEECH] [SPEECH] 133 -> (135,136) 0.003921
[SPEECH] [SPEECH] 132 -> (134,134) 0.000291
[SPEECH] [SPEECH] 130 -> (132,132) 0.000162
[NOISE] [NOISE] 130 -> (132,132) 0.000123
<sil> <sil> 129 -> (131,136) 0.009269
<sil> <sil> 128 -> (130,130) 0.040601
<sil> <sil> 126 -> (128,128) 0.000819
to to 117 -> (122,140) 0.002236
to to(2) 117 -> (122,145) 0.009973
to to(3) 117 -> (122,143) 0.004366
<sil> <sil> 119 -> (121,127) 0.004372
[SPEECH] [SPEECH] 118 -> (120,120) 0.000447
[NOISE] [NOISE] 118 -> (120,120) 0.000390
<sil> <sil> 118 -> (120,120) 0.002747
words words 94 -> (119,125) 0.000108
<sil> <sil> 116 -> (118,118) 0.000580
<sil> <sil> 115 -> (117,117) 0.000184
forwards forwards 64 -> (117,129) 0.000441
work work 94 -> (115,119) 0.001027
word word 94 -> (112,132) 0.000980
forward forward 64 -> (109,137) 0.858630
a a 91 -> (93,93) 0.000126
for for 64 -> (82,112) 0.001032
so so 50 -> (59,67) 0.000544
though though 46 -> (55,67) 0.000156
go go 46 -> (52,69) 0.995808
[SPEECH] [SPEECH] 43 -> (45,45) 0.033124
[NOISE] [NOISE] 42 -> (44,46) 0.064389
[SPEECH] [SPEECH] 40 -> (42,42) 0.001064
[NOISE] [NOISE] 40 -> (42,42) 0.002398
[SPEECH] [SPEECH] 39 -> (41,41) 0.002080
[NOISE] [NOISE] 39 -> (41,41) 0.003592
[NOISE] [NOISE] 37 -> (39,39) 0.000165
[NOISE] [NOISE] 36 -> (38,38) 0.000278
[SPEECH] [SPEECH] 34 -> (36,39) 0.000173
<sil> <sil> 25 -> (27,55) 0.594485
[SPEECH] [SPEECH] 22 -> (24,24) 0.014665
[NOISE] [NOISE] 22 -> (24,24) 0.010713
oh oh 22 -> (24,24) 0.001547
i i 22 -> (24,24) 0.008968
a a 22 -> (24,24) 0.002466
the the(2) 19 -> (24,25) 0.003408
the the 19 -> (24,27) 0.010659
to to(3) 19 -> (24,26) 0.001076
it it 19 -> (24,24) 0.004264
in in 19 -> (24,24) 0.001084
do do 19 -> (24,25) 0.000543
at at 19 -> (24,28) 0.000459
to to(2) 19 -> (24,25) 0.000889
<sil> <sil> 20 -> (22,26) 0.247818
a a(2) 20 -> (22,25) 0.001175
[SPEECH] [SPEECH] 19 -> (21,21) 0.000228
[NOISE] [NOISE] 19 -> (21,21) 0.000280
i i 19 -> (21,22) 0.000396
[SPEECH] [SPEECH] 17 -> (19,19) 0.005254
[SPEECH] [SPEECH] 16 -> (18,18) 0.000279
[NOISE] [NOISE] 16 -> (18,20) 0.010348
[NOISE] [NOISE] 14 -> (16,16) 0.000358
[NOISE] [NOISE] 13 -> (15,15) 0.000660
[SPEECH] [SPEECH] 11 -> (13,16) 0.000698
<sil> <sil> 8 -> (10,21) 0.077181
[SPEECH] [SPEECH] 5 -> (7,7) 0.005162
[NOISE] [NOISE] 5 -> (7,7) 0.004412
<sil> <sil> 5 -> (7,8) 0.022713
oh oh 5 -> (7,7) 0.000235
<s> <s> 0 -> (2,55) 0.349545
FORWARD entries:
go 46 -> 63 prob 0.995808 ascr -404480
though 46 -> 63 prob 0.000156 ascr -847872
so 50 -> 63 prob 0.000544 ascr -817152
FORWARD exits:
64 -> 114 prob 0.000240 ascr -1242112
64 -> 115 prob 0.000578 ascr -1186816
64 -> 117 prob 0.002580 ascr -1245184
64 -> 117 prob 0.000366 ascr -1376256
64 -> 117 prob 0.000420 ascr -1376256
64 -> 118 prob 0.003939 ascr -1283072
64 -> 116 prob 0.011305 ascr -1130496
64 -> 116 prob 0.022955 ascr -1130496
64 -> 116 prob 0.004703 ascr -1130496
64 -> 125 prob 0.000633 ascr -1729536
64 -> 127 prob 0.031730 ascr -1821696
64 -> 128 prob 0.005941 ascr -1870848
64 -> 132 prob 0.000668 ascr -2307072
64 -> 116 prob 0.858630 ascr -1130496
64 -> 120 prob 0.014978 ascr -1259520
64 -> 130 prob 0.000556 ascr -2207744
64 -INFO: ps_lattice.c(219): Writing lattice file: goforward.lat
INFO: ps_lattice.c(423): Reading DAG file: goforward.lat
INFO: ps_lattice.c(1380): Bestpath score: -2147483648
INFO: ps_lattice.c(1384): Normalizer P(O) = alpha(</s>:212:263) = -536870912
INFO: ps_lattice.c(1441): Joint P(O,S) = 0 P(S|O) = 536870912
INFO: ngram_search_fwdtree.c(429): TOTAL fwdtree 0.85 CPU 0.323 xRT
INFO: ngram_search_fwdtree.c(432): TOTAL fwdtree 0.87 wall 0.328 xRT
INFO: dict.c(320): Allocating 4096 * 32 bytes (128 KiB) for word entries
INFO: ps_lattice.c(423): Reading DAG file: goforward.lat
INFO: dict.c(320): Allocating 4096 * 32 bytes (128 KiB) for word entries
INFO: ps_lattice.c(423): Reading DAG file: ../../test/data/unreachable.lat
> 130 prob 0.034826 ascr -2207744
64 -> 116 prob 0.000295 ascr -1130496
[SPEECH] [SPEECH] 209 -> (211,211) 0.041132
[NOISE] [NOISE] 209 -> (211,211) 0.020500
<sil> <sil> 209 -> (211,211) 0.101290
leaders leaders 155 -> (194,213) 0.016074
majors majors 153 -> (194,213) 0.012557
readers readers 155 -> (192,213) 0.014153
meters meters 153 -> (173,221) 0.793480
<sil> <sil> 150 -> (152,152) 0.110620
<sil> <sil> 147 -> (149,149) 0.018053
and and(2) 131 -> (144,162) 0.040036
an an 131 -> (138,162) 0.014366
can can 121 -> (137,164) 0.015389
ten ten 117 -> (136,164) 0.831003
<sil> <sil> 128 -> (130,130) 0.040601
forward forward 64 -> (109,137) 0.858630
go go 46 -> (52,69) 0.995808
[SPEECH] [SPEECH] 43 -> (45,45) 0.033124
[NOISE] [NOISE] 42 -> (44,46) 0.064389
<sil> <sil> 25 -> (27,55) 0.594485
[SPEECH] [SPEECH] 22 -> (24,24) 0.014665
[NOISE] [NOISE] 22 -> (24,24) 0.010713
the the 19 -> (24,27) 0.010659
<sil> <sil> 20 -> (22,26) 0.247818
[NOISE] [NOISE] 16 -> (18,20) 0.010348
<sil> <sil> 8 -> (10,21) 0.077181
<sil> <sil> 5 -> (7,8) 0.022713
<s> <s> 0 -> (2,55) 0.349545
FORWARD entries:
go 46 -> 63 prob 0.995808 ascr -404480
FORWARD exits:
64 -> 130 prob 0.034826 ascr -2207744
64 -> 120 prob 0.014978 ascr -1259520
64 -> 116 prob 0.858630 ascr -1130496
64 -> 127 prob 0.031730 ascr -1821696
P(S|O) = 536870912
[SPEECH] [SPEECH] 209 -> (211,211) 1.000000
[NOISE] [NOISE] 209 -> (211,211) 1.000000
<sil> <sil> 209 -> (211,211) 1.000000
leaders leaders 155 -> (194,213) 0.152206
majors majors 153 -> (194,213) 0.222245
readers readers 155 -> (192,213) 0.177479
meters meters 153 -> (173,221) 0.153690
and and(2) 131 -> (144,162) inf
<sil> <sil> 128 -> (130,130) inf
forward forward 64 -> (109,137) inf
[SPEECH] [SPEECH] 22 -> (24,24) inf
[NOISE] [NOISE] 22 -> (24,24) inf
the the 19 -> (24,27) inf
[NOISE] [NOISE] 16 -> (18,20) inf
<sil> <sil> 8 -> (10,21) inf
FORWARD entries:
FORWARD exits:
64 -> 127 prob inf ascr -1919665152
64 -> 120 prob inf ascr -1289748480
[SPEECH] [SPEECH] 209 -> (211,211) 1.000000
[NOISE] [NOISE] 209 -> (211,211) 1.000000
<sil> <sil> 209 -> (211,211) 1.000000
leaders leaders 155 -> (194,213) 1.000000
majors majors 153 -> (194,213) 1.000000
readers readers 155 -> (192,213) 1.000000
meters meters 153 -> (173,221) 1.000000
<sil> <sil> 150 -> (152,152) 1.000000
<sil> <sil> 147 -> (149,149) 1.000000
and and(2) 131 -> (144,162) 1.000000
an an 131 -> (138,162) 1.000000
can can 121 -> (137,164) 1.000000
ten ten 117 -> (136,164) 1.000000
<sil> <sil> 128 -> (130,130) 1.000000
forward forward 64 -> (109,137) 1.000000
go go 46 -> (52,69) 1.000000
[SPEECH] [SPEECH] 43 -> (45,45) 1.000000
[NOISE] [NOISE] 42 -> (44,46) 1.000000
<sil> <sil> 25 -> (27,55) 1.000000
[SPEECH] [SPEECH] 22 -> (24,24) 1.000000
[NOISE] [NOISE] 22 -> (24,24) 1.000000
the the 19 -> (24,27) 1.000000
<sil> <sil> 20 -> (22,26) 1.000000
[NOISE] [NOISE] 16 -> (18,20) 1.000000
<sil> <sil> 8 -> (10,21) 1.000000
<sil> <sil> 5 -> (7,8) 1.000000
<s> <s> 0 -> (2,55) 1.000000
FORWARD entries:
go 46 -> 63 prob 1.000000 ascr -414187520
FORWARD exits:
64 -> 127 prob 1.000000 ascr -1865416704
64 -> 116 prob 1.000000 ascr -1157627904
64 -> 120 prob 1.000000 ascr -1289748480
64 -> 130 prob 1.000000 ascr 2034237440
Remaining 3 nodes 2 links
