INFO: pocketsphinx.c(152): Parsed model-specific feature parameters from ../../test/data/an4_ci_cont/feat.params
Current configuration:
[NAME]			[DEFLT]		[VALUE]
-agc			none		none
-agcthresh		2.0		2.000000e+00
-allphone				
-allphone_ci		no		no
-alpha			0.97		9.700000e-01
-ascale			20.0		2.000000e+01
-aw			1		1
-backtrace		no		no
-beam			1e-48		1.000000e-48
-bestpath		yes		yes
-bestpathlw		9.5		9.500000e+00
-ceplen			13		13
-cmn			live		current
-cmninit		40,3,-1		40,3,-1
-compallsen		no		no
-debug					0
-dict					../../test/data/turtle.dic
-dictcase		no		no
-dither			no		no
-doublebw		no		no
-ds			1		1
-fdict					
-feat			1s_c_d_dd	1s_c_d_dd
-featparams				
-fillprob		1e-8		1.000000e-08
-frate			100		100
-fsg					
-fsgusealtpron		yes		yes
-fsgusefiller		yes		yes
-fwdflat		yes		yes
-fwdflatbeam		1e-64		1.000000e-64
-fwdflatefwid		4		4
-fwdflatlw		8.5		8.500000e+00
-fwdflatsfwin		25		25
-fwdflatwbeam		7e-29		7.000000e-29
-fwdtree		yes		yes
-hmm					../../test/data/an4_ci_cont
-input_endian		little		little
-jsgf					
-keyphrase				
-kws					
-kws_delay		10		10
-kws_plp		1e-1		1.000000e-01
-kws_threshold		1		1.000000e+00
-latsize		5000		5000
-lda					
-ldadim			0		0
-lifter			0		0
-lm					../../test/data/turtle.lm.bin
-lmctl					
-lmname					
-logbase		1.0001		1.000100e+00
-logfn					
-logspec		no		no
-lowerf			133.33334	1.333334e+02
-lpbeam			1e-40		1.000000e-40
-lponlybeam		7e-29		7.000000e-29
-lw			6.5		6.500000e+00
-maxhmmpf		30000		30000
-maxwpf			-1		-1
-mdef					
-mean					
-mfclogdir				
-min_endfr		0		0
-mixw					
-mixwfloor		0.0000001	1.000000e-07
-mllr					../../test/data/mllr_matrices
-mmap			yes		yes
-ncep			13		13
-nfft			512		512
-nfilt			40		40
-nwpen			1.0		1.000000e+00
-pbeam			1e-48		1.000000e-48
-pip			1.0		1.000000e+00
-pl_beam		1e-10		1.000000e-10
-pl_pbeam		1e-10		1.000000e-10
-pl_pip			1.0		1.000000e+00
-pl_weight		3.0		3.000000e+00
-pl_window		5		5
-rawlogdir				
-remove_dc		no		no
-remove_noise		yes		yes
-remove_silence		yes		yes
-round_filters		yes		yes
-samprate		16000		1.600000e+04
-seed			-1		-1
-sendump				
-senlogdir				
-senmgau				
-silprob		0.005		5.000000e-03
-smoothspec		no		no
-svspec					
-tmat					
-tmatfloor		0.0001		1.000000e-04
-topn			4		4
-topn_beam		0		0
-toprule				
-transform		legacy		legacy
-unit_area		yes		yes
-upperf			6855.4976	6.855498e+03
-uw			1.0		1.000000e+00
-vad_postspeech		50		50
-vad_prespeech		20		20
-vad_startspeech	10		10
-vad_threshold		2.0		2.000000e+00
-var					
-varfloor		0.0001		1.000000e-04
-varnorm		no		no
-verbose		no		no
-warp_params				
-warp_type		inverse_linear	inverse_linear
-wbeam			7e-29		7.000000e-29
-wip			0.65		6.500000e-01
-wlen			0.025625	2.562500e-02

INFO: feat.c(715): Initializing feature stream to type: '1s_c_d_dd', ceplen=13, CMN='batch', VARNORM='no', AGC='none'
INFO: mdef.c(518): Reading model definition: ../../test/data/an4_ci_cont/mdef
INFO: bin_mdef.c(181): Allocating 140 * 8 bytes (1 KiB) for CD tree
INFO: tmat.c(149): Reading HMM transition probability matrices: ../../test/data/an4_ci_cont/transition_matrices
INFO: acmod.c(113): Attempting to use PTM computation module
INFO: ms_gauden.c(127): Reading mixture gaussian parameter: ../../test/data/an4_ci_cont/means
INFO: ms_gauden.c(242): 102 codebook, 1 feature, size: 
INFO: ms_gauden.c(244):  1x39
INFO: ms_gauden.c(127): Reading mixture gaussian parameter: ../../test/data/an4_ci_cont/variances
INFO: ms_gauden.c(242): 102 codebook, 1 feature, size: 
INFO: ms_gauden.c(244):  1x39
INFO: ms_gauden.c(304): 0 variance values floored
INFO: ptm_mgau.c(808): Number of codebooks doesn't match number of ciphones, doesn't look like PTM: 102 != 34
INFO: acmod.c(115): Attempting to use semi-continuous computation module
INFO: ms_gauden.c(127): Reading mixture gaussian parameter: ../../test/data/an4_ci_cont/means
INFO: ms_gauden.c(242): 102 codebook, 1 feature, size: 
INFO: ms_gauden.c(244):  1x39
INFO: ms_gauden.c(127): Reading mixture gaussian parameter: ../../test/data/an4_ci_cont/variances
INFO: ms_gauden.c(242): 102 codebook, 1 feature, size: 
INFO: ms_gauden.c(244):  1x39
INFO: ms_gauden.c(304): 0 variance values floored
INFO: acmod.c(117): Falling back to general multi-stream GMM computation
INFO: ms_gauden.c(127): Reading mixture gaussian parameter: ../../test/data/an4_ci_cont/means
INFO: ms_gauden.c(242): 102 codebook, 1 feature, size: 
INFO: ms_gauden.c(244):  1x39
INFO: ms_gauden.c(127): Reading mixture gaussian parameter: ../../test/data/an4_ci_cont/variances
INFO: ms_gauden.c(242): 102 codebook, 1 feature, size: 
INFO: ms_gauden.c(244):  1x39
INFO: ms_gauden.c(304): 0 variance values floored
INFO: ms_senone.c(149): Reading senone mixture weights: ../../test/data/an4_ci_cont/mixture_weights
INFO: ms_senone.c(200): Truncating senone logs3(pdf) values by 10 bits
INFO: ms_senone.c(207): Not transposing mixture weights in memory
INFO: ms_senone.c(268): Read mixture weights for 102 senones: 1 features x 1 codewords
INFO: ms_senone.c(320): Mapping senones to individual codebooks
INFO: ms_mgau.c(144): The value of topn: 4
WARN: "ms_mgau.c", line 148: -topn argument (4) invalid or > #density codewords (1); set to latter
INFO: ps_mllr.c(66): Reading MLLR transformation file '../../test/data/mllr_matrices'
INFO: ms_gauden.c(127): Reading mixture gaussian parameter: ../../test/data/an4_ci_cont/means
INFO: ms_gauden.c(242): 102 codebook, 1 feature, size: 
INFO: ms_gauden.c(244):  1x39
INFO: ms_gauden.c(127): Reading mixture gaussian parameter: ../../test/data/an4_ci_cont/variances
INFO: ms_gauden.c(242): 102 codebook, 1 feature, size: 
INFO: ms_gauden.c(244):  1x39
INFO: ms_gauden.c(304): 0 variance values floored
INFO: phone_loop_search.c(114): State beam -225 Phone exit beam -225 Insertion penalty 0
INFO: dict.c(320): Allocating 4209 * 32 bytes (131 KiB) for word entries
INFO: dict.c(333): Reading main dictionary: ../../test/data/turtle.dic
ERROR: "dict.c", line 195: Line 20: Phone 'NG' is mising in the acoustic model; word 'doing' ignored
ERROR: "dict.c", line 195: Line 32: Phone 'SH' is mising in the acoustic model; word 'finish' ignored
ERROR: "dict.c", line 195: Line 54: Phone 'NG' is mising in the acoustic model; word 'listening' ignored
ERROR: "dict.c", line 195: Line 55: Phone 'NG' is mising in the acoustic model; word 'listening(2)' ignored
ERROR: "dict.c", line 195: Line 89: Phone 'DH' is mising in the acoustic model; word 'the' ignored
ERROR: "dict.c", line 195: Line 90: Phone 'DH' is mising in the acoustic model; word 'the(2)' ignored
ERROR: "dict.c", line 195: Line 91: Phone 'DH' is mising in the acoustic model; word 'the(3)' ignored
ERROR: "dict.c", line 195: Line 92: Phone 'DH' is mising in the acoustic model; word 'then' ignored
INFO: dict.c(213): Dictionary size 102, allocated 0 KiB for strings, 0 KiB for phones
INFO: dict.c(336): 102 words read
INFO: dict.c(358): Reading filler dictionary: ../../test/data/an4_ci_cont/noisedict
INFO: dict.c(213): Dictionary size 105, allocated 0 KiB for strings, 0 KiB for phones
INFO: dict.c(361): 3 words read
INFO: dict2pid.c(396): Building PID tables for dictionary
INFO: dict2pid.c(406): Allocating 34^3 * 2 bytes (76 KiB) for word-initial triphones
INFO: dict2pid.c(132): Allocated 28016 bytes (27 KiB) for word-final triphones
INFO: dict2pid.c(196): Allocated 28016 bytes (27 KiB) for single-phone word triphones
INFO: ngram_model_trie.c(354): Trying to read LM in trie binary format
INFO: ngram_search_fwdtree.c(74): Initializing search tree
INFO: ngram_search_fwdtree.c(101): 63 unique initial diphones
INFO: ngram_search_fwdtree.c(186): Creating search channels
INFO: ngram_search_fwdtree.c(323): Max nonroot chan increased to 297
INFO: ngram_search_fwdtree.c(333): Created 63 root, 169 non-root channels, 6 single-phone words
INFO: ngram_search_fwdflat.c(157): fwdflat: min_ef_width = 4, max_sf_win = 25
INFO: cmn.c(133): CMN:  7.98 -0.39 -0.08  0.02 -0.04 -0.14 -0.12 -0.12 -0.17 -0.12 -0.15 -0.09 -0.06 
INFO: ngram_search_fwdtree.c(1550):      358 words recognized (1/fr)
INFO: ngram_search_fwdtree.c(1552):     6258 senones evaluated (24/fr)
INFO: ngram_search_fwdtree.c(1556):     6126 channels searched (23/fr), 3889 1st, 720 last
INFO: ngram_search_fwdtree.c(1559):      720 words for which last channels evaluated (2/fr)
INFO: ngram_search_fwdtree.c(1561):       92 candidate words for entering last phone (0/fr)
INFO: ngram_search_fwdtree.c(1564): fwdtree 0.01 CPU 0.004 xRT
INFO: ngram_search_fwdtree.c(1567): fwdtree 0.01 wall 0.004 xRT
INFO: ngram_search_fwdflat.c(302): Utterance vocabulary contains 12 words
INFO: ngram_search_fwdflat.c(948):      505 words recognized (2/fr)
INFO: ngram_search_fwdflat.c(950):     4603 senones evaluated (17/fr)
INFO: ngram_search_fwdflat.c(952):     3214 channels searched (12/fr)
INFO: ngram_search_fwdflat.c(954):     2393 words searched (8/fr)
INFO: ngram_search_fwdflat.c(957):      513 word transitions (1/fr)
INFO: ngram_search_fwdflat.c(960): fwdflat 0.00 CPU 0.000 xRT
INFO: ngram_search_fwdflat.c(963): fwdflat 0.00 wall 0.000 xRT
INFO: ngram_search.c(1250): lattice start node <s>.0 end node </s>.214
INFO: ngram_search.c(1276): Eliminated 0 nodes before end node
INFO: ngram_search.c(1381): Lattice has 19 nodes, 6 links
INFO: ps_lattice.c(1380): Bestpath score: -7520
INFO: ps_lattice.c(1384): Normalizer P(O) = alpha(</s>:214:264) = -477176
INFO: ps_lattice.c(1441): Joint P(O,S) = -477275 P(S|O) = -99
INFO: ngram_search.c(872): bestpath 0.00 CPU 0.000 xRT
INFO: ngram_search.c(875): bestpath 0.00 wall 0.000 xRT
INFO: ngram_search_fwdtree.c(429): TOTAL fwdtree 0.01 CPU 0.004 xRT
INFO: ngram_search_fwdtree.c(432): TOTAL fwdtree 0.01 wall 0.004 xRT
INFO: ngram_search_fwdflat.c(176): TOTAL fwdflat 0.00 CPU 0.000 xRT
INFO: ngram_search_fwdflat.c(179): TOTAL fwdflat 0.00 wall 0.000 xRT
INFO: ngram_search.c(303): TOTAL bestpath 0.00 CPU 0.000 xRT
INFO: ngram_search.c(306): TOTAL bestpath 0.00 wall 0.000 xRT
FWDFLAT: go to a (-7850)
